reflector_ip,ip_version,description,country_code,country_name,region,sub_region
67.227.134.12,4,flow3d.com,KW,Kuwait,Asia,Western Asia
194.54.192.98,4,Ookla Speedtest server: speedtest.gulfnet.com.kw,KW,Kuwait,Asia,Western Asia
94.128.15.9,4,Ookla Speedtest server: speedtest1.viva.com.kw,KW,Kuwait,Asia,Western Asia
212.43.17.251,4,Ookla Speedtest server: speedtest1.zain.net,KW,Kuwait,Asia,Western Asia
62.215.170.104,4,Ookla Speedtest server: test.fasttelco.com,KW,Kuwait,Asia,Western Asia
168.187.161.250,4,Zajil International Telecom Company W.L.L.,KW,Kuwait,Asia,Western Asia
